text,cleaned_text,agg_labels
 Happy Mother`s Day to the only mother I have on my list!,happy mothers day mother list,1
wishes a Happy Mother`s Day to all mothers! Especially her own.  http://plurk.com/p/svg9d,wishes happy mothers day mothers especially httpplurkcompsvgd,1
Good morning. Just bought flowers for mothers day and now it`s breakfast time,good morning bought flowers mothers day breakfast time,1
Just saw Star Trek with the boo.. Now off to bed! Never again will I go to a Vallejo theater. hAppy mOthErs dAy to all!! I love my mommy,saw star trek boo bed never go vallejo theater happy mothers day love mommy,1
"_RICHARDS A man loves his sweetheart the most, his wife the best, but his mother the longest. Happy Mother`s Day",richards man loves sweetheart wife best mother longest happy mothers day,1
home bound for mothers day,home bound mothers day,1
  I miss all you OK girls.    Happy Mother`s Day to all y`all.,miss ok girls happy mothers day yall,1
12:06am and my 'him' is officially the 1st one to say Happy Mother`s Day to me   I love it!!!,officially st one say happy mothers day love,1
"too much good food on this Mother`s Day. not that i`m complaining! Seafood, durian puffs and macarons! yum!",much good food mothers day im complaining seafood durian puffs macarons yum,1
Had a lovely Mothers Day,lovely mothers day,1
happy mothers day!  <3,happy mothers day,1
" I have the best bestfriend in the whole world .. My Mother`s Day present = ambien, klonopin and a quarter! woohoo!  smh...",best bestfriend whole world mothers day present ambien klonopin quarter woohoo smh,1
"What have you done for Mother`s Day?'*people who are a day behind us*'what will you be doing?' I took my Mom to Starbucks, she enjoyed it",done mothers daypeople day behind uswhat took mom starbucks enjoyed,1
"had the best mother`s day! breakfast, shopping and lunch, drinks, chocolate galore!",best mothers day breakfast shopping lunch drinks chocolate galore,1
Happy Mother`s Day to all the Mothers! Especially mine!  Enjoy ya day mothers!,happy mothers day mothers especially mine enjoy ya day mothers,1
i just wanna say happy mother`s day to all the mommy`s out there,wan na say happy mothers day mommys,1
Happy Mother`s Day to all my twitter moms (including myself),happy mothers day twitter moms including,1
Happy Star Wars Day? OHHHH...now I get it. May the 4th be with you.  love it. (and mondays). (sorry again) #starwarsday,happy star wars day ohhhhnow get may th love mondays sorry starwarsday,1
" thanks for the follow, your family photo is beautiful  happy mother`s day to your wife!",thanks follow family photo beautiful happy mothers day wife,1
Bed. Church in the morning. Happy mothers day,bed church morning happy mothers day,1
"writing out mother`s day cards to mom, aunts, and AMYYYY can`t wait for her to be a mommy",writing mothers day cards mom aunts amyyyy cant wait mommy,1
HAPPY MOTHERS DAY TO ALL THE MOMS OUT THERE !!!,happy mothers day moms,1
 Happy Mothers Day!,happy mothers day,1
" ok, so I`m replying!  happy mothers day, indeed!",ok im replying happy mothers day indeed,1
Happy Mothers Day Everybody!!!!!!,happy mothers day everybody,1
Oh Mother - Christina Aguilera. Happy Mothers` Day to all the mamas!  ilovemymommy! <3,oh mother christina aguilera happy mothers day mamas ilovemymommy,1
"Happy Mother`s day to allMothers, Cheers!!",happy mothers day allmothers cheers,1
happpppy mothers day,happpppy mothers day,1
Happy Mother`s day to all beautiful mother. May your love shines the world  Thank you mum.....,happy mothers day beautiful mother may love shines world thank mum,1
GM Tweeters! Happy Mother`s Day to the mothers and pretend mothers out there!,gm tweeters happy mothers day mothers pretend mothers,1
WH Correspondant`s Dinner Rocked! Wanda Sykes was hilarious and Obama wasn`t too bad  Happy Mother`s Day to all the mom`s out there......,wh correspondants dinner rocked wanda sykes hilarious obama wasnt bad happy mothers day moms,1
 thanks love ) btw happy mother`s day to your mom,thanks love btw happy mothers day mom,1
MAY THE 4TH BE WITH YOU. Happy Star Wars Day,may th happy star wars day,1
Wishing  a Happy Mothers Day,wishing happy mothers day,1
home in carlsbad with the whole family for mother`s day!,home carlsbad whole family mothers day,1
happy mother`s day to all mothers out there!!,happy mothers day mothers,1
Happy Mums Day This is Nelly`s shout out   http://skitch.com/t/tac,happy mums day nellys shout httpskitchcomttac,1
Happy Mother`s day !!!! Show some love to your Beautiful and Amazing Mom!!  <3,happy mothers day show love beautiful amazing mom,1
"_dizon it`s a little late but congratulations, leah  happy mothers day!",dizon little late congratulations leah happy mothers day,1
New comic posted. Introducing  'Joe! - The Mini Strip'  http://tinyurl.com/oasxx2 (via ) cute Mother`s day strip!,new comic posted introducing joe mini strip httptinyurlcomoasxx via cute mothers day strip,1
"mothers day, happy mothers day mom",mothers day happy mothers day mom,1
aww happy mother`s day,aww happy mothers day,1
HAPPY MOTHER`S DAY TO ALL OUR MOMS!,happy mothers day moms,1
I have coffee and a Sociology paper to complete. Happy Mothers Day,coffee sociology paper complete happy mothers day,1
" Happy mother`s day! Hope you have a great one with Harlow, your mom and those you love  You`re such an awesome mommy! ^^",happy mothers day hope great one harlow mom love youre awesome mommy,1
Happy Mother`s Day to Us  FOR NOT BEIN MAMMAS YET and being lucky enough to live our lives a little 1st,happy mothers day us bein mammas yet lucky enough live lives little st,1
HAPPY MOTHER`S DAY!!!!!,happy mothers day,1
_O_ASH I do too plus more happy mothers day Sweety,oash plus happy mothers day sweety,1
Happy mother`s day !!!!,happy mothers day,1
mothers day at the spit was awesome!!!!!!!  listening to Paranoid by The Jonas Brothers!!!!!!!!!,mothers day spit awesome listening paranoid jonas brothers,1
"says good morning everyone! Once again, a happy mother`s day to all the mothers out there!  I hope you all h... http://plurk.com/p/stq3f",says good morning everyone happy mothers day mothers hope h httpplurkcompstqf,1
Happy Star Wars day everyone,happy star wars day everyone,1
in Newcastle enjoying the family  With mum on mother`s day for the 1st time in years!,newcastle enjoying family mum mothers day st time years,1
"I am so grateful I am your daughter!  Happy Mother`s Day, Okasan.  Thank you for everything... always!",grateful daughter happy mothers day okasan thank everything always,1
 He`s my mother`s favorite. It was so hard telling her.,hes mothers favorite hard telling,1
Goodnight everyone  Happy Mothers Day to all of the mothers out there,goodnight everyone happy mothers day mothers,1
"Happy Mother`s Day, amma!  I made u cake, remember? U loved it!",happy mothers day amma made u cake remember u loved,1
  Happy Mothers day!! ****,happy mothers day,1
 Happy Mother`s Day!!,happy mothers day,1
based on the similarity between 'May the 4th be with you' and 'May the force be with you' today it`s the 'Star Wars Day',based similarity may th may force today star wars day,1
Haha Happy Star Wars Day!  'May the 4th be with you' - clever,haha happy star wars day may th clever,1
HaPPy Mothers Day!!!,happy mothers day,1
Sleepy time! Happy Mothers` Day to current and future moms around the globe!,sleepy time happy mothers day current future moms around globe,1
Bout to go to bed... Happy Mother`s Day ladies .... especially all th 1s who takin care of thier kids alone..n I Love U Momma,bout go bed happy mothers day ladies especially th takin care thier kids alonen love u momma,1
Omg! Star Wars Day!  May the fourth be with you everyone  This calls for me to watch at least 1 film tonight.,omg star wars day may fourth everyone calls watch least film tonight,1
aww my son gave me a purple g shock for mother`s day,aww son gave purple g shock mothers day,1
Happy Mother`s Day,happy mothers day,1
going to bed happy mothers day people,going bed happy mothers day people,1
happy mothers day to all those special moms out there.... i luv u mommy!!,happy mothers day special moms luv u mommy,1
"It`s Happy Star Wars Day, LOL.  May the force be strong with you all.",happy star wars day lol may force strong,1
Happy mothers day to all the mommies,happy mothers day mommies,1
Happy mother`s day everyone!,happy mothers day everyone,1
forgot she had a Twitter account.    Happy Mother`s Day!,forgot twitter account happy mothers day,1
"Happy sunday, beautiful day in London... off to meet Chergo for breakfast  ****",happy sunday beautiful day london meet chergo breakfast,1
"happy mothers day to all the mothers, grandmothers, furbaby mommies, etc!  heading out for breakfast with my mom shortly",happy mothers day mothers grandmothers furbaby mommies etc heading breakfast mom shortly,1
Mothers day isnt until the 31th here in sweden.But thnx for the pm`s,mothers day isnt th swedenbut thnx pms,1
"happy mother`s day to all the mama`s out there, be greatful and appreciate your mama",happy mothers day mamas greatful appreciate mama,1
I dedicated today to Mothers Day videos because without Moms (and Dads) we wouldn`t be here tweeting.,dedicated today mothers day videos without moms dads wouldnt tweeting,1
Night Night Everyone.    HAPPY MOTHERS DAY to all mothers,night night everyone happy mothers day mothers,1
"happy mothers day @ my mum  (also to my sis  and my 'mum' jess, ahah)",happy mothers day mum also sis mum jess ahah,1
May the Forth be with you... ha yes... Today is my birthday  Star Wars day... Aren`t i lucky you star wars Fans?,may forth ha yes today birthday star wars day arent lucky star wars fans,1
Writing Mother`s Day cards for my mom and gran...  hurray!,writing mothers day cards mom gran hurray,1
Just had mothers day lunch here  http://twitpic.com/4wfeo,mothers day lunch httptwitpiccomwfeo,1
Happy mother`s day and to the god mother`s and step mother`s too....,happy mothers day god mothers step mothers,1
got an email from my auntie bout fathers day... mothers day w/seven moms but fathers day will consist of 2 dads    #realitycheck,got email auntie bout fathers day mothers day wseven moms fathers day consist dads realitycheck,1
 Did you know its Star Wars Day today... May the 4th be with you!,know star wars day today may th,1
" ooh a storm, that`s always welcome news  Happy Mothers Day!",ooh storm thats always welcome news happy mothers day,1
Love my mommy happy mothers day,love mommy happy mothers day,1
ofcourse they start fightin aight the party buts its cool theyu held it down now im chillin with my home girl  HAPPY MOTHERS DAY,ofcourse start fightin aight party buts cool theyu held im chillin home girl happy mothers day,1
Happy Mother`s Day Mama bear,happy mothers day mama bear,1
"Happy Mother`s day! Going to cook something, thank goodness there`s tablespotting",happy mothers day going cook something thank goodness theres tablespotting,1
" Oh, and Happy Judd Day haha  #juddday",oh happy judd day haha juddday,1
got it? good. HAPPY MOTHERS DAY!,got good happy mothers day,1
wishes Happy Mother`s Day!,wishes happy mothers day,1
A VERY HAPPY MOTHER`S DAY TO ALL MOTHERS OUT THERE! Mamma Mia - Abba   ? http://blip.fm/~5z5uw,happy mothers day mothers mamma mia abba httpblipfmzuw,1
 mothers day pak...,mothers day pak,1
Goin to bed... Finally. So sleepy! *Happy mothers day!*,goin bed finally sleepy happy mothers day,1
"butterfly fly away- miley ray  , oh & happy mothers day <3 love u mami.",butterfly fly away miley ray oh happy mothers day love u mami,1
Happy Mother`s Day  http://bit.ly/LRSnG,happy mothers day httpbitlylrsng,1
Happy Star Wars Day! .... May the 4th Be with You!,happy star wars day may th,1
Is...Sayin Happy Mother`s Day 2 Everyone!!!!!,issayin happy mothers day everyone,1
HAPPY MOTHERS DAY to everyone lucky enough to be a mommy. extra special happy to  who became a mommy 2day,happy mothers day everyone lucky enough mommy extra special happy became mommy day,1
" Hey Sam, happy mothers day",hey sam happy mothers day,1
 oh! i love that as well!! all of MCR songs are great!  and happy star wars day to yaa xD,oh love well mcr songs great happy star wars day yaa xd,1
yum - mother`s day lunch at The Food Business in Burnside was delicious! such a gorgeous day,yum mothers day lunch food business burnside delicious gorgeous day,1
is having a quiet mothers day evening... happy mothers day to all the yummy mummies,quiet mothers day evening happy mothers day yummy mummies,1
Happy Star Wars Day everyone! May the 4th be with you,happy star wars day everyone may th,1
"loves the new Mother`s Day snl digital short, mother lover, oohhhh cornyness",loves new mothers day snl digital short mother lover oohhhh cornyness,1
"Star Wars day? I didn`t know there was a such thing  May the force, be with you <3",star wars day didnt know thing may force,1
Happy Mother`s Day! I love my mommy,happy mothers day love mommy,1
its like 2 in the morning..sometimes I just don`t know exactly what is best to do..but I will def. figure it out!  ...HAPPY MOMS DAY!,like morningsometimes dont know exactly best dobut def figure happy moms day,1
  i just want to wish your mom a happy mothers day!,want wish mom happy mothers day,1
http://twitpic.com/4wh0o - My mommys gummy mothers day posterrr!,httptwitpiccomwho mommys gummy mothers day posterrr,1
Just want to wish everyond a Happy Mother`s Day. Hope it`s a great one!,want wish everyond happy mothers day hope great one,1
 Sunday and Mother`s day!,sunday mothers day,1
Happy Mothers Day,happy mothers day,1
mum`s day - ended up being happy  not that it`s my day or anything....,mums day ended happy day anything,1
 anychance you can get matthew to give a shout out to my mum Sarah for mothers day! we saw 'Ghosts from girlfriends past today',anychance get matthew give shout mum sarah mothers day saw ghosts girlfriends past today,1
 Happy Mother`s Day!  Hugs~,happy mothers day hugs,1
happy mothers day to all motherssss!  <3333,happy mothers day motherssss,1
Happy Mothers day to all the Mom`s on there!!,happy mothers day moms,1
Happy Star Wars Day!!! May The 4th Be With You!,happy star wars day may th,1
happy mother`s day!  http://bit.ly/6fGxd,happy mothers day httpbitlyfgxd,1
in rye..happy mothers day mums  ily mummy  lol,ryehappy mothers day mums ily mummy lol,1
 happy mommas day . ging is so lucky to have a momma like u  enjoy ur nite! luv ya,happy mommas day ging lucky momma like u enjoy ur nite luv ya,1
  holla happy early mother`s day,holla happy early mothers day,1
Looking forward to having Dinner with Family and Friendsss! Happy Mothers Day to all the Moms out there!,looking forward dinner family friendsss happy mothers day moms,1
Happy Mother`s Day to all to all the wonderful moms out there.  -Matalatine,happy mothers day wonderful moms matalatine,1
Happy Mama`s day to all mothers,happy mamas day mothers,1
 Happy mother`s day to Ms. Pat Carey,happy mothers day ms pat carey,1
" Correction: 'facetious' not 'sarcastic.' Apologies.  Oh, and happy Mother`s Day!",correction facetious sarcastic apologies oh happy mothers day,1
#Happy Mother`s Day euch allen,happy mothers day euch allen,1
 HAPPY MOTHERS DAY MARK,happy mothers day mark,1
Happy Mother`s Day to all mothers!,happy mothers day mothers,1
HAPPY MOTHERS DAY MOMMY!!!!,happy mothers day mommy,1
 Happy Anoop Day to you Monica,happy anoop day monica,1
"Happy Mother`s Day to all the Mom`s out there, but especially to my wonderfuly Mommy",happy mothers day moms especially wonderfuly mommy,1
Happy mothers day  I`m so hungry and the resturants are all closed... ****,happy mothers day im hungry resturants closed,1
: Happy Mother`s day to my Mother. Thank you for being such an awesome mother,happy mothers day mother thank awesome mother,1
 It was on March 22nd in UK..today all quiet here regarding mothers day  Very sweet of u to wish though..thanks!,march nd uktoday quiet regarding mothers day sweet u wish thoughthanks,1
  Thank you and Happy Mothers Day to your Mother also SNL tonight,thank happy mothers day mother also snl tonight,1
Happy Mother`s Day! She liked the poem.,happy mothers day liked poem,1
Happy Mothers Day!!,happy mothers day,1
happy almost mother`s day,happy almost mothers day,1
I want to wish HAPPY MOTHER`S DAY to my two favorite moms in the world: My own mom of course  and my sister!!! HAPPY MOM`S DAY TO YOU TWO!,want wish happy mothers day two favorite moms world mom course sister happy moms day two,1
I truly praise God for my mom-the greatest mother in the world  Happy mother`s day to all of the mothers reading this. Enjoy your day!,truly praise god momthe greatest mother world happy mothers day mothers reading enjoy day,1
happy mother`s day to all your mom`s,happy mothers day moms,1
mothers day drama was awesome!,mothers day drama awesome,1
Happy mother`s day all you moms!,happy mothers day moms,1
"Happy mother`s day!!! oh, I love my mom.. hehehe... happy mom`s day!!",happy mothers day oh love mom hehehe happy moms day,1
 Happy mothers day to you beautiful!,happy mothers day beautiful,1
 Happy Mother`s Day hahaha,happy mothers day hahaha,1
may the fourth be with you  happy star wars day.,may fourth happy star wars day,1
Happy mothers day everybody,happy mothers day everybody,1
Happy Mothers Day! Will be going out later at 6 pm to watch a well renowned group of singers!,happy mothers day going later pm watch well renowned group singers,1
Happy mother`s day to all moms!,happy mothers day moms,1
Happy Mothers Day!!!!,happy mothers day,1
" MC, happy mother`s day to your mom ;).. love yah",mc happy mothers day mom love yah,1
Happy Mothers Day to all you mom out there,happy mothers day mom,1
haha so bored...but happy mothers day!,haha boredbut happy mothers day,1
  Then Google Vs. Twitter . Mother`s Day Vs. Mothers Day . . Mother`s Day - web1.0 type. Mothers Day is Social Media -web2.0,google vs twitter mothers day vs mothers day mothers day web type mothers day social media web,1
"happy mother`s day, mom  I hope the breakfast was nice.  I love u ?",happy mothers day mom hope breakfast nice love u,1
happy mommy day!!,happy mommy day,1
"happy mothers day, too all mums out there  remember treat your mum well, she brought you into this life =]",happy mothers day mums remember treat mum well brought life,1
"Good Night,  Happy Mother`s Day !!",good night happy mothers day,1
 happy early mothers day!!!!,happy early mothers day,1
made breakfast today......Happy mother`s day ..,made breakfast todayhappy mothers day,1
Happy Star Wars day!!  unbelievable,happy star wars day unbelievable,1
HAPPY MOTHER`S DAY,happy mothers day,1
wishes Happy mother`s day to all mothers!!!,wishes happy mothers day mothers,1
"had a great time celebrating mother`s day  to me, being a mom is the best job on earth!",great time celebrating mothers day mom best job earth,1
Just gave my mommy her Mother`s Day present...a purple ipod  http://twitpic.com/4wcpt,gave mommy mothers day presenta purple ipod httptwitpiccomwcpt,1
 Happy mothers day,happy mothers day,1
Celebrated Mother`s Day with the best lamb roast lunch followed by a box of Cadbury`s shared around the table. It was a wonderful day,celebrated mothers day best lamb roast lunch followed box cadburys shared around table wonderful day,1
Happy mothers day to all the mums!,happy mothers day mums,1
Signing off to spend time with my hubby   Goodnight / day tweeple!   Have a very Happy Mother`s Day!,signing spend time hubby goodnight day tweeple happy mothers day,1
Celebrating mother`s day with apple pie,celebrating mothers day apple pie,1
"Happy mothers day to all the Twitter moms, sent my own mom a very sleepy video by phone and called after.",happy mothers day twitter moms sent mom sleepy video phone called,1
"Happy 'Star Wars' Day, Twitters.  http://migre.me/SiE :*",happy star wars day twitters httpmigremesie,1
Exhausted after coming home from a swim this morning! It`s more tiring than I remember! HAPPY MOTHERS DAY,exhausted coming home swim morning tiring remember happy mothers day,1
" not cool, Mark, this song is going to be stuck in my head all day. but I love you, anyway... is it Star Wars Day today? cool",cool mark song going stuck head day love anyway star wars day today cool,1
is also wishing these two lovely mothers  &  a very special Mother`s Day!!!  enjoy!,also wishing two lovely mothers special mothers day enjoy,1
HAPPY MOTHERS DAY TO ALL THE MOMMIES,happy mothers day mommies,1
Now I`m off to bed - HAPPY MOTHER`S DAY ALL - HAVE A GREAT ONE,im bed happy mothers day great one,1
4:15 finally home from the city.  - now time to head to sleep!!  goodnight! & happy mommy`s day to all the mother`s out there!!,finally home city time head sleep goodnight happy mommys day mothers,1
Happy Star Wars Day everyone! May the 4th be with you all  ****,happy star wars day everyone may th,1
happy mommys day!,happy mommys day,1
Officially Mother Day here HAPPY Mother Day to all the MOMS,officially mother day happy mother day moms,1
just getting off of work for the day! Hope everyone has a wonderful mother`s day tomorrow! Hope you enjoy ur cheesecakes too!,getting work day hope everyone wonderful mothers day tomorrow hope enjoy ur cheesecakes,1
Happy Mother`s Day!  @>--->--->--- A rose for YOU!,happy mothers day rose,1
is wishing all of the mother`s out there a very Happy Mother`s Day!! Love ya!,wishing mothers happy mothers day love ya,1
Time for me to go to sleep! It`s almost 1am. Night everyone! Happy mothers day to all the moms out there,time go sleep almost night everyone happy mothers day moms,1
Happy Mothers Day to all the mums in my life and those that are not,happy mothers day mums life,1
Happy Mother`s Day to all your wonderful moms!,happy mothers day wonderful moms,1
Happy Mother`s Day to all of the woman and the men who made them mothers.,happy mothers day woman men made mothers,1
HaPPy MothErS Day!!! Feliz Dia deLAS MAdres  mine is already in Heaven.. =( Miss you...,happy mothers day feliz dia delas madres mine already heaven miss,1
HAPPY MOTHER`S DAY LADIES!!! Hope you all have a wonderful day.,happy mothers day ladies hope wonderful day,1
migraine and leg pain and woe ): should go to bed but it is 2 flights of stairs away. Happy mother`s day,migraine leg pain woe go bed flights stairs away happy mothers day,1
http://snipurl.com/hq0n1 Just printed my mom an Amazon gift card  for Happy Mothers Day talk about last minute.,httpsnipurlcomhqn printed mom amazon gift card happy mothers day talk last minute,1
HAPPY MOTHER`S DAYYYY!!!,happy mothers dayyyy,1
HAPPY MOTHERS DAY TO ALL THE MOTHERS IN THE WORLD ESPECIALLY THE TWEETER MOMS,happy mothers day mothers world especially tweeter moms,1
happy mothers day,happy mothers day,1
Gave my mommy her Mother`s Day present. Tickets to Aerosmith (her favorite band everr.) Yay for a good reaction.,gave mommy mothers day present tickets aerosmith favorite band everr yay good reaction,1
"might be seeing my god mothers little boy in a bit  . Leon, so cute <3333",might seeing god mothers little boy bit leon cute,1
Happy mother`s day to all the mums out there,happy mothers day mums,1
Happy Mommy Day,happy mommy day,1
Happy Grey`s day everyone! Oh I miss Grey`s!!,happy greys day everyone oh miss greys,1
"OK. Happy Star Wars Day, everyone. As they say, May the 4th be with you",ok happy star wars day everyone say may th,1
happy mothers day to all the baby mommasss! rofl,happy mothers day baby mommasss rofl,1
"happy mothers day.  oh and no i havent read it yet, will do now",happy mothers day oh havent read yet,1
HAPPY MOTHER`S DAY!,happy mothers day,1
off to pearlyn`s place - gran`s bday + mothers` day dinner tonight!  mom went for adults` svc today!!!  (L) happy mothers` day moms!,pearlyns place grans bday mothers day dinner tonight mom went adults svc today l happy mothers day moms,1
is excited about so R and R for mother`s day,excited r r mothers day,1
taking mum to lunch for mothers day,taking mum lunch mothers day,1
Happy Mother`s Day to all the moms out there! Just finished having lunch with my  relatives. I wuv you mommy and granny.  HAHAHA.,happy mothers day moms finished lunch relatives wuv mommy granny hahaha,1
Sleepy time..   happy mothers day all u momz,sleepy time happy mothers day u momz,1
 Thanks!!!!  Happy Mother`s day to you too!!,thanks happy mothers day,1
" Hey JK...Wish Evenlyn a Happy Mothers Day tomora for me..I had a Great Day, my gift will be tickets to see ya`s ere in Oz",hey jkwish evenlyn happy mothers day tomora mei great day gift tickets see yas ere oz,1
"Happy Mother`s Day to all the moms! If you`re an awesome mom, you`ll help #savechuck",happy mothers day moms youre awesome mom youll help savechuck,1
Happy Mothers Day Mum,happy mothers day mum,1
Happy Mother`s Day to all you moms out there,happy mothers day moms,1
and Happy Mothers Day to All you Moms out there i hope you had a good day,happy mothers day moms hope good day,1
Happy Mother`s day! Sent msg to mom and got her phone call. I wish one day we can live in the same city so I can take care of her.,happy mothers day sent msg mom got phone call wish one day live city take care,1
Happy Mother`s Day everyone.,happy mothers day everyone,1
"Had a neat mothers day - nothing flash, just some chillin time with my girls",neat mothers day nothing flash chillin time girls,1
 Happy mother`s day to ur mom!!! i hope she has a wonderful day!!!!!,happy mothers day ur mom hope wonderful day,1
Happy Mother`s Day!,happy mothers day,1
Happy Christmas! No wait... What is it again happy M...........easels day. No but seriously.... Happy Mothers day...  lmao,happy christmas wait happy measels day seriously happy mothers day lmao,1
Happy Star Wars Day! May the Fourth be with you.,happy star wars day may fourth,1
today is going to be a long day,today going long day,1
its mothers day,mothers day,1
   HAPPY MOTHERS DAY!! LOVE YOU GUYS...,happy mothers day love guys,1
