text,cleaned_text,agg_labels
making my mom a mothers day card,making mom mothers day card,1
happy mother`s day to your moms,happy mothers day moms,1
" Happy Mother`s Day, Kadi!!",happy mothers day kadi,1
happy mothers day to all the beautful mums.,happy mothers day beautful mums,1
 My pleasure. I can`t be with my mom on Mother`s Day. But I can spread love.,pleasure cant mom mothers day spread love,1
Happy Mother`s Day! Justin Timberlake`s version a mother`s day gift.. http://bit.ly/6fGxd  -- too funny!!!,happy mothers day justin timberlakes version mothers day gift httpbitlyfgxd funny,1
"Happy Mother`s Day!!!  I`m at the beach with my family. It`s a warm, clear night with a beautiful full moon...",happy mothers day im beach family warm clear night beautiful full moon,1
is freaking exhausted...need to go to bed....gotta get up early YUCK....HAPPY MOTHER`S DAY TO ALL YOU MOMMIES OUT THERE,freaking exhaustedneed go bedgotta get early yuckhappy mothers day mommies,1
happy mothers day to all   im off to spend the day with my family,happy mothers day im spend day family,1
"Psalm 82:6 I have said, You are gods; and all of you are children of the most High. Happy Mothers Day Momma",psalm said gods children high happy mothers day momma,1
Happy mother`s day everyone! still playing pet society!,happy mothers day everyone still playing pet society,1
Ahhh mothers day  My first one YAY!!!,ahhh mothers day first one yay,1
" Wishing you a very Happy Mother`s Day, Carina!!  Hugs...Joy",wishing happy mothers day carina hugsjoy,1
 ay uuuu  happy mothers day,ay uuuu happy mothers day,1
" as nerdy as I am, I just found out it was Star Wars day today!  I love you D",nerdy found star wars day today love,1
happy mothers day. ekin sayang mak!!!,happy mothers day ekin sayang mak,1
He he ...Happy #star wars day! May the 4th be with you  Brilliant!!,happy star wars day may th brilliant,1
hi to all twit friends  happy mother`s day to all the beautiful and amazing mothers out there,hi twit friends happy mothers day beautiful amazing mothers,1
"I`m so excited for Mothers Day!  This has been a big year for me & Olivia, and she`s finally old enough to be excited & understand!",im excited mothers day big year olivia shes finally old enough excited understand,1
fel�z dia de madres  | happy mothers day,felz dia de madres happy mothers day,1
  happy mommy day Teens-thanks FFF,happy mommy day teensthanks fff,1
Happy mothers dat,happy mothers dat,1
fighting with mum on mothers day,fighting mum mothers day,1
"Dinner party was great!  Happy, full clients that is what I like to end my day with",dinner party great happy full clients like end day,1
Happy mother`s day ,happy mothers day,1
"Incase I forget, Happy Mother`s Day to all you moms out there, and to my mommy. The very best one in the world",incase forget happy mothers day moms mommy best one world,1
It`s Midnight - I`m outta here.  HAPPY MOTHER`S DAY FELLOW MOMMIES!!!  (And to non-Mommies too).  May EVERYONE have a special day!!!,midnight im outta happy mothers day fellow mommies nonmommies may everyone special day,1
"Home. Tired. Phone then bed.   Good night tweeters, happy mothers day!",home tired phone bed good night tweeters happy mothers day,1
 Happy frickin` birthday!  Try not to be too bitter about sharing your day with your lovely wife and all other mothers out there.,happy frickin birthday try bitter sharing day lovely wife mothers,1
"Happy Star Wars Day, everyone! May the force be with you all, be you Padawan or Jedi.",happy star wars day everyone may force padawan jedi,1
Nothing exciting from me tonight....got some new toys to play with though  Happy Mother`s Day Ladies,nothing exciting tonightgot new toys play though happy mothers day ladies,1
Happy mothers day in 25 minutes everyone,happy mothers day minutes everyone,1
happy mothers day to my mom & all the other mommies / moms to be! have a qood one ladies,happy mothers day mom mommies moms qood one ladies,1
Happy Mothers Day to all you mothers out there!!  i love my mom! GOODNIGHT everyonee!! ?,happy mothers day mothers love mom goodnight everyonee,1
Missing my mother... t-11 days! HAPPY MOTHER`S DAY!!,missing mother days happy mothers day,1
I am off to bed now....my family has a wonderful day planned for me today      Happy Mother`s Day,bed nowmy family wonderful day planned today happy mothers day,1
HAPPY MOTHER DAY JANEY! EVEN THOUGH IDK IF YOUR A MOMMY!,happy mother day janey even though idk mommy,1
wants to wish all the moms a Happy Mother`s Day.  Hope you`re all treated like Queens!,wants wish moms happy mothers day hope youre treated like queens,1
 Aren`t randoms what it`s about?!!!  I LOVE that it`s Star Wars day - I didn`t realise and I can`t believe it`s almost over!,arent randoms love star wars day didnt realise cant believe almost,1
Happy Mothers Day  Breakfast With The Fam <33,happy mothers day breakfast fam,1
Happy Mother`s day to all the mom`s out there in twitter-land!,happy mothers day moms twitterland,1
 Happy Mother`s Day! Hope you have an awesome time with the Bug,happy mothers day hope awesome time bug,1
haha May the 4th be with you! Happy Star Wars Day!,haha may th happy star wars day,1
happy mothers day!!,happy mothers day,1
Mothers day today!,mothers day today,1
Happy Mother`s Day to all the Mom`s out there I happen to have the greatest Mom in the world  I love my Mom she`s my best friend,happy mothers day moms happen greatest mom world love mom shes best friend,1
Happy Mother`s day; God bless you & all mother`s worldwide; mother nature...  technology emotion in motion...,happy mothers day god bless mothers worldwide mother nature technology emotion motion,1
 happy mothers day to you as well!,happy mothers day well,1
" Hi Lisa, you have the most BEAUTIFUL pups! HAPPY MOTHERS DAY!2 Raven, Rio& Thors WONDERFUR mama!!  *kittykisses*",hi lisa beautiful pups happy mothers day raven rio thors wonderfur mama kittykisses,1
shoutout to all the beautiful moms out there that these niggas dont appreciate! some one cares Happy Mothers Day!,shoutout beautiful moms niggas dont appreciate one cares happy mothers day,1
"o, and happy mothers day",happy mothers day,1
"Oh and PS. Since it is already 12:30, I should probably say 'Happy Mother`s Day' to my Mom and all the mothers out there!",oh ps since already probably say happy mothers day mom mothers,1
HAPPY MOTHER`S DAY !!,happy mothers day,1
"Happy Mother`s Day! Be sure to say I <3 you, Mum.",happy mothers day sure say mum,1
Happy Star Wars Day!,happy star wars day,1
I`m so stupid! It`s Star Wars Day!!! May the 4th be with you!!!,im stupid star wars day may th,1
happy mothers day to all..,happy mothers day,1
", , , , i hope you all have a happy mothers day!",hope happy mothers day,1
Happy Mother`s Day to all of the mothers and mothers-to-be  My mom is getting a special gift from me today,happy mothers day mothers motherstobe mom getting special gift today,1
May the 4th be with you! Happy Star Wars Day twirps!  ROFL,may th happy star wars day twirps rofl,1
HAPPY MOTHER`S DAYYY!,happy mothers dayyy,1
is home whoott. Happy Mother`s Day Madre,home whoott happy mothers day madre,1
" Too easy! Happy Mother`s Day, to a great mom!",easy happy mothers day great mom,1
Happy mama`s day to all the mamas.,happy mamas day mamas,1
"Happy Mother`s Day to all the amazing women who put up with us crazy, demanding children. Thank you.  Very very much.",happy mothers day amazing women put us crazy demanding children thank much,1
happy mothers day to all moms out there!!,happy mothers day moms,1
grinning like a Cheshire cat.... ....happy as hell. they made my day  ??,grinning like cheshire cat happy hell made day,1
"7 hours and many massages later, I can now spend time with my wife and son. It`s mother`s day ya`ll. Don`t forget to grab a gift or card.",hours many massages later spend time wife son mothers day yall dont forget grab gift card,1
HAPPY MOTHER DAY TO ALL THE MOTHER`S IN THE ENTIRE WORLD WE DESERVED A DAY JUST FOR US RIGHT...,happy mother day mothers entire world deserved day us right,1
Why is it that America celebrates mother`s day on a different day to England? Anyhooo...Happy Mother`s Day 2 All American Mumzys!  x,america celebrates mothers day different day england anyhooohappy mothers day american mumzys x,1
phillies gamee with mama for mothers day,phillies gamee mama mothers day,1
Happy Mother`s Day - Happy Mother�s Day  http://tumblr.com/xnx1qyn0j,happy mothers day happy mothers day httptumblrcomxnxqynj,1
  Happy Mother`s Day to both of yall.  from me and my boys...,happy mothers day yall boys,1
HAPPY MOTHERS DAY  ASAP EVERYDAY!!!,happy mothers day asap everyday,1
Happy Mothers Day  All my love,happy mothers day love,1
"happy mother`s day, mommy! hope you will have a good day",happy mothers day mommy hope good day,1
Happy Mothers Day to all the Mommies!,happy mothers day mommies,1
Happy Baby Mommas Day!!  to all the>> MOMMAS<< on Twitterville,happy baby mommas day mommas twitterville,1
Happy Mothers Day to all Mom`s,happy mothers day moms,1
The hair looks sicckkkk.  Happy mothers day to all the mothers!,hair looks sicckkkk happy mothers day mothers,1
HAPPY MOTHER`S DAY TO ALL THE WONDERFUL MOTHERS IN THE WORLD!!! myself included...,happy mothers day wonderful mothers world included,1
Happy Mother`s Day to all the mothers out there! Do have a good and enjoyable day,happy mothers day mothers good enjoyable day,1
Morning all - happy Star Wars day - May the 4th be with you!,morning happy star wars day may th,1
greeting again every momma : Happy Momma`s Day!,greeting every momma happy mommas day,1
Mother`s Day is THIS Sunday.... don`t forget to send her something special  http://www.youtube.com/watch?v=ExpmTEVSFQg,mothers day sunday dont forget send something special httpwwwyoutubecomwatchvexpmtevsfqg,1
 hay naku!!madaya ka talaga ah hehe ..hey happy mothers day to your mom nga pala   and to your mom also,hay nakumadaya ka talaga ah hehe hey happy mothers day mom nga pala mom also,1
happy Mother`s Day to all the moms out there,happy mothers day moms,1
"Happy Mothers Day! Same day, more chocolate",happy mothers day day chocolate,1
Is it OK to send iFlowers to your mom for Mother`s Day trough this iPhone app? http://tr.im/kWnX,ok send iflowers mom mothers day trough iphone app httptrimkwnx,1
Happy Star Wars Day. May the 4th be with you!  Nice that we get a holiday to celebrate  #fb,happy star wars day may th nice get holiday celebrate fb,1
Happy mother`s day to all moms out there!  i just played tong-its a while ago.,happy mothers day moms played tongits ago,1
 happy mother`s day! you are beautiful.,happy mothers day beautiful,1
Happy moms day,happy moms day,1
A very special HAPPY MOTHER`S DAY to all Mommies!,special happy mothers day mommies,1
Happy mothers dayyy all mothers especially mine,happy mothers dayyy mothers especially mine,1
Good morning World! Happy Star Wars Day! May the 4th be with you!,good morning world happy star wars day may th,1
This is dedicated to all those moms out there - Happy Mother`s Day  ? http://blip.fm/~5z2g9,dedicated moms happy mothers day httpblipfmzg,1
Happy Mother`s Day Mommies,happy mothers day mommies,1
" I will, n btw happy mothers day sissy",n btw happy mothers day sissy,1
 hope you have a great day tomorrow!!  happy mothers day!  let us know what you did,hope great day tomorrow happy mothers day let us know,1
"done with the fkn exam! n just bought the mothers day gift, finally... tada! the new prada fragrance  going to meet up mum n fam now : ...",done fkn exam n bought mothers day gift finally tada new prada fragrance going meet mum n fam,1
happy mother`s day everyone,happy mothers day everyone,1
"fuckkk i need sleepppppppp lol, happy mothers day mummy",fuckkk need sleepppppppp lol happy mothers day mummy,1
"Took yesterday off & treated myself to an outfit & shoes, I have not treated myself in a while, my mothers day gift to me",took yesterday treated outfit shoes treated mothers day gift,1
OMJ JUSt qOt HOME fROM tHAt PARty! it`S 2:OO a.m! i`M MAN tiRED! GOODNiqHt AND HAPPY MOtHER`S DAY 2 ALL!!! tAkE CARE & GOD BlESS!,omj qot home party oo im man tired goodniqht happy mothers day take care god bless,1
I want to wish all the Mommy`s a happy mothers day!,want wish mommys happy mothers day,1
happy mothers day..,happy mothers day,1
A Happy Mother`s Day to all moms and soon to be mom`s out there.,happy mothers day moms soon moms,1
Star wars day! May the 4th be with you.,star wars day may th,1
Happy Mother`s Day! It will be a good day,happy mothers day good day,1
happy mother`s dayy!!! to me andd the rest of the fabulous mommy`s out there,happy mothers dayy andd rest fabulous mommys,1
Happy Mother`s Day to all the mothers!!,happy mothers day mothers,1
mothers day..didnt do anything exciting...saw a movie,mothers daydidnt anything excitingsaw movie,1
"Happy Mothers Day to all that are, all that are trying, and all that haven`t nailed their teenagers to a tree",happy mothers day trying havent nailed teenagers tree,1
Happy Mother`s Day to all the mamas out there,happy mothers day mamas,1
happy maders day,happy maders day,1
   Happy mother`s day to your moms.,happy mothers day moms,1
Happy Star Wars day,happy star wars day,1
happy mothers day x & go the dockers,happy mothers day x go dockers,1
Going I sleep today was a long day happy mothers day to all the moms out there,going sleep today long day happy mothers day moms,1
Ok all have hit the point of relaxation.. heading to bed  sleep well and Happy Mother`s day to all you Moms out there!! Night,ok hit point relaxation heading bed sleep well happy mothers day moms night,1
Mothers day in 45 minutes west coast time.  Happy Mothers Day to all the mothers out there,mothers day minutes west coast time happy mothers day mothers,1
Happy mother`s Day!!!! No gift to your mother can ever equal her gift to you - life,happy mothers day gift mother ever equal gift life,1
happy mother`s day to all the moms out there. i hope i never join that crowd,happy mothers day moms hope never join crowd,1
happy mother`s daaaaaaaaay,happy mothers daaaaaaaaay,1
"Happy Mother`s Day to all the Ladies... With all the moments we cherish with our children, today let those moments cherish you in return.",happy mothers day ladies moments cherish children today let moments cherish return,1
Happy Mother`s Day to every single mom out there. I love my mommy,happy mothers day every single mom love mommy,1
Happy Mothers day  <3,happy mothers day,1
Goodnight!  Happy Mothers Day!,goodnight happy mothers day,1
" You got it! YAAAY!!! I was really worried your phone wouldn`t fit, so glad it does!  Happy Mother`s Day, lol!",got yaaay really worried phone wouldnt fit glad happy mothers day lol,1
may the 4th be with you! HAPPY STAR WARS DAY!,may th happy star wars day,1
Today I wrote two songs (one for temple which I will probably never perform ever) and one for mothers day. Happy vesak everyone  rena xoxo,today wrote two songs one temple probably never perform ever one mothers day happy vesak everyone rena xoxo,1
Happy Mother`s Day :] I lovee you mami,happy mothers day lovee mami,1
 Good morning David! Happy Mother`s Day to your mom lol. Too bad u can`t be with her. She is so awesome!,good morning david happy mothers day mom lol bad u cant awesome,1
: So wonderful to spend Mother`s Day with my mum.,wonderful spend mothers day mum,1
Listening to Lady Gaga... Relatives just left after our Mother`s Day celebration,listening lady gaga relatives left mothers day celebration,1
"Word to all those i call mom, and there are a lot of yall.. HAPPY MOTHERS DAY  i love you all!",word call mom lot yall happy mothers day love,1
wish all the mother in the flatworld have a happy & awesome mother`s day,wish mother flatworld happy awesome mothers day,1
Happy Mothers Day to all Mothers every where,happy mothers day mothers every,1
Wishing all the Mom`s in the world a VERY HAPPY AND RELAXING MOTHERS DAY. May you get to spend the day with your feet up being pampered,wishing moms world happy relaxing mothers day may get spend day feet pampered,1
you know what`s today? no? it`s the Star Wars day you ****!,know whats today star wars day,1
" yep, it�s Mothers Day here as well but me and my family ignore it!  we�re celebrating it EVERY day ... LOL",yep mothers day well family ignore celebrating every day lol,1
Happy Mother`s Day to the tweetin` mamas  Nite tweeple!,happy mothers day tweetin mamas nite tweeple,1
"Repeat final seconds of Game 3 Dal-Den please! **** THOSE OFFICIALS. :| Anyway, happy mothers day.",repeat final seconds game dalden please officials anyway happy mothers day,1
happy mother`s to all the moms out there..,happy mothers moms,1
Happy Mothers Day to All the Mom`s out there!! We Love You!!!,happy mothers day moms love,1
Happy Hug Your Mom Day!! love you mom,happy hug mom day love mom,1
says again.. happy mothers day to all your moms  http://plurk.com/p/svdsh,says happy mothers day moms httpplurkcompsvdsh,1
Good Morning everybody and happy Mothers Day!!!!,good morning everybody happy mothers day,1
" Peace Bro, thanks for not just the music, but proudly representing as a father all over - Happy Mother`s Day",peace bro thanks music proudly representing father happy mothers day,1
" Thanks hon, doing great and yourself? Happy Mothers Day",thanks hon great happy mothers day,1
TIRED! goodnight twitter  its mother`s day  happy mother`s day  lov my moomy <3 yayy! God Bless.,tired goodnight twitter mothers day happy mothers day lov moomy yayy god bless,1
Happy Mother`s day to MOMMY,happy mothers day mommy,1
Home at last HAPPY MOTHERS TO ALL THE MOTHERS Special thanks to my father he bought me tulips so did my princess  adult swim time (anime),home last happy mothers mothers special thanks father bought tulips princess adult swim time anime,1
"Christa`s Mothers Day card, deep in the build phase.   - Photo: http://bkite.com/07k6e",christas mothers day card deep build phase photo httpbkitecomke,1
Wishing everyone a Happy Mother`s Day.  xoxo,wishing everyone happy mothers day xoxo,1
 Happy mom`s day to you too,happy moms day,1
Good Morning and Happy Mothers Day everyone,good morning happy mothers day everyone,1
Happy Mother`s Day to all the American mamas!,happy mothers day american mamas,1
To all mothers in the world : happy mothers day,mothers world happy mothers day,1
"BTW, Happy Star Wars Day... May the Fourth be with you! ROFLMAO...yes, I know I`m a total dork.",btw happy star wars day may fourth roflmaoyes know im total dork,1
happy mother`s day! I love you mama,happy mothers day love mama,1
Happy Mothers Day. Take ur mothers into a special place.,happy mothers day take ur mothers special place,1
 Happy Mothers Day! i hope tom got you something special! enjoy day!  xo,happy mothers day hope tom got something special enjoy day xo,1
Happy Mothers Day to Heidi Klum,happy mothers day heidi klum,1
Wishing all Mothers Happy Mother`s Day,wishing mothers happy mothers day,1
So grateful for my amazing family. How blessed am I. Happy Mothers day everyone,grateful amazing family blessed happy mothers day everyone,1
Happy Mother`s Day to all you mother`s in Twitterville!,happy mothers day mothers twitterville,1
Happy Mother`s Day to every mommy out there,happy mothers day every mommy,1
  Morning!  Happy Mother`s Day Miz!!!  Thank you Lance!!!!,morning happy mothers day miz thank lance,1
 happy mothers day ang,happy mothers day ang,1
" its not mothers day on the west coast, tyvm",mothers day west coast tyvm,1
Happy Mothers Day mom!  I love you!,happy mothers day mom love,1
 Happy Mother`s Day ~ Did you watch SNL?  If not U missed a hoot with Jimmy Fallon,happy mothers day watch snl u missed hoot jimmy fallon,1
Happy Star Wars Day // Will Week,happy star wars day week,1
Happy mother`s day nfty!!!!!!!!!!!!!!!!!!!!!!,happy mothers day nfty,1
 mothers day gift,mothers day gift,1
Happy Mother`s Day !,happy mothers day,1
Happy Mothers Day to all the Mommys.,happy mothers day mommys,1
Happy Mother`s day to all mum`s in america,happy mothers day mums america,1
